<?xml version="1.0" encoding="UTF-8"?>
<FLC xsi:noNamespaceSchemaLocation="flc.xsd" xmlns:xsi="http://www.w3.org/2001/XMLSchema-instance">
	<Version>2013.11.05</Version>
	<Layers>
		<Layer>
			<Name>pPk_p</Name>
			<Geometry>Point Features</Geometry>
			<ZValues>true</ZValues>
			<CheckSelfIntersect>false</CheckSelfIntersect>
			<Fields>
				<Field>
					<Name>CLS_TYPE</Name>
					<Type>Text</Type>
					<Length>50</Length>
					<CheckRegExp>^010[23]000$</CheckRegExp>
				</Field>
				<Field>
					<Name>NUM</Name>
					<Type>Text</Type>
					<Length>255</Length>
					<CheckRegExp>^\d+/\d+$</CheckRegExp>
				</Field>
				<Field>
					<Name>ASUP_ID</Name>
					<Type>Long Integer</Type>
				</Field>
				<Field>
					<Name>GID</Name>
					<Type>Text</Type>
					<Unique>true</Unique>
					<CheckRegExp>^.+$</CheckRegExp>
				</Field>
			</Fields>
		</Layer>
		<Layer>
			<Name>pPOI_p</Name>
			<Geometry>Point Features</Geometry>
			<ZValues>false</ZValues>
			<CheckSelfIntersect>false</CheckSelfIntersect>
			<Checks>
				<Check>
					<Name>Для станции или перегона наименование д.б.заполнено</Name>
					<JS><![CDATA[(!(([KEY] ==1) && ([VALUE] == 1 || [VALUE] == 2) && ([NAME] == false)))]]></JS>
				</Check>
			</Checks>
			<Fields>
				<Field>
					<Name>KEY</Name>
					<Type>Short Integer</Type>
					<CheckRegExp>^[1-9]|10|11|12|13|14|15|16$</CheckRegExp>
				</Field>
				<Field>
					<Name>GID</Name>
					<Type>Text</Type>
					<Unique>true</Unique>
					<CheckRegExp>^.+$</CheckRegExp>
				</Field>
				<Field>
					<Name>AXIS_GID</Name>
					<Type>Text</Type>
					<References>
						<Reference>
							<ParentLayer>wAxes_l</ParentLayer>
							<ParentField>GID</ParentField>
							<Cardinality>
								<Min>0</Min>
							</Cardinality>
						</Reference>
					</References>
					<CheckRegExp>^.+$</CheckRegExp>
				</Field>
				<Field>
					<Name>VALUE</Name>
					<Type>Short Integer</Type>
				</Field>
				<Field>
					<Name>NAME</Name>
					<Type>Text</Type>
					<Length>255</Length>
				</Field>
			</Fields>
		</Layer>
		<Layer>
			<Name>wRails_l</Name>
			<Geometry>Line Features</Geometry>
			<ZValues MinZ="1" MaxZ="2000" MaxRake="200">true</ZValues>
			<CheckSelfIntersect>true</CheckSelfIntersect>
			<NoCrossLayers>
				<Layer>wPlatf_a</Layer>
				<Layer>wSettl_a</Layer>
				<Layer>wTower_a</Layer>
				<Layer>wTrLig_a</Layer>
			</NoCrossLayers>
			<CurvatureMinAngle>170</CurvatureMinAngle>
			<Fields>
				<Field>
					<Name>GID</Name>
					<Type>Text</Type>
					<Unique>true</Unique>
					<CheckRegExp>^.+$</CheckRegExp>
				</Field>
				<Field>
					<Name>NUM</Name>
					<Type>Text</Type>
					<CheckRegExp>^[01]$</CheckRegExp>
				</Field>
				<Field>
					<Name>ASUP_ID</Name>
					<Type>Long Integer</Type>
				</Field>
				<Field>
					<Name>CLS_TYPE</Name>
					<Type>Text</Type>
					<Length>50</Length>
					<CheckRegExp>^050[23]000$</CheckRegExp>
				</Field>
			</Fields>
		</Layer>
		<Layer>
			<Name>pSta_p</Name>
			<Geometry>Point Features</Geometry>
			<ZValues>false</ZValues>
			<CheckSelfIntersect>false</CheckSelfIntersect>
			<Fields>
				<Field>
					<Name>GID</Name>
					<Type>Text</Type>
					<Unique>true</Unique>
					<CheckRegExp>^.+$</CheckRegExp>
				</Field>
				<Field>
					<Name>CLS_TYPE</Name>
					<Type>Text</Type>
					<Length>50</Length>
					<CheckRegExp>^0407000$</CheckRegExp>
				</Field>
				<Field>
					<Name>NAME</Name>
					<Type>Text</Type>
					<Length>255</Length>
					<CheckRegExp>^.+$</CheckRegExp>
				</Field>
				<Field>
					<Name>SIDE</Name>
					<Type>Short Integer</Type>
					<CheckRegExp>^[123]$</CheckRegExp>
				</Field>
			</Fields>
		</Layer>
		<Layer>
			<Name>wSurf_p</Name>
			<Geometry>Point Features</Geometry>
			<ZValues>true</ZValues>
			<CheckSelfIntersect>false</CheckSelfIntersect>
			<Fields>
				<Field>
					<Name>GID</Name>
					<Type>Text</Type>
					<Unique>true</Unique>
					<CheckRegExp>^.+$</CheckRegExp>
				</Field>
				<Field>
					<Name>CLS_TYPE</Name>
					<Type>Text</Type>
					<Length>50</Length>
					<CheckRegExp>^0105000$</CheckRegExp>
				</Field>
			</Fields>
		</Layer>
		<Layer>
			<Name>wAxes_l</Name>
			<Geometry>Line Features</Geometry>
			<ZValues MinZ="1" MaxZ="2000" MaxRake="200">true</ZValues>
			<CheckSelfIntersect>true</CheckSelfIntersect>
			<NoCrossLayers>
				<Layer>wPlatf_a</Layer>
				<Layer>wSettl_a</Layer>
				<Layer>wTower_a</Layer>
				<Layer>wTrLig_a</Layer>
			</NoCrossLayers>
			<CurvatureMinAngle>170</CurvatureMinAngle>
			<Fields>
				<Field>
					<Name>GID</Name>
					<Type>Text</Type>
					<Unique>true</Unique>
					<CheckRegExp>^.+$</CheckRegExp>
				</Field>
				<Field>
					<Name>CLS_TYPE</Name>
					<Type>Text</Type>
					<Length>50</Length>
					<CheckRegExp>^0501000$</CheckRegExp>
				</Field>
				<Field>
					<Name>NUM</Name>
					<Type>Text</Type>
					<Length>255</Length>
				</Field>
				<Field>
					<Name>LEFT_RAIL_GID</Name>
					<Type>Text</Type>
					<References>
						<Reference>
							<ParentLayer>wRails_l</ParentLayer>
							<ParentField>GID</ParentField>
							<Cardinality>
								<Min>0</Min>
							</Cardinality>
						</Reference>
					</References>
					<CheckRegExp>^.+$</CheckRegExp>
				</Field>
				<Field>
					<Name>RIGHT_RAIL_GID</Name>
					<Type>Text</Type>
					<References>
						<Reference>
							<ParentLayer>wRails_l</ParentLayer>
							<ParentField>GID</ParentField>
							<Cardinality>
								<Min>0</Min>
							</Cardinality>
						</Reference>
					</References>
					<CheckRegExp>^.+$</CheckRegExp>
				</Field>
				<Field>
					<Name>WAY_TYPE</Name>
					<Type>Short Integer</Type>
					<CheckRegExp>^[1-9]|10|11|12|13|14|15|23$</CheckRegExp>
				</Field>
				<Field>
					<Name>ASUP_ID</Name>
					<Type>Long Integer</Type>
				</Field>
				<Field>
					<Name>BEGIN_AXIS_GID</Name>
					<Type>Text</Type>
					<References>
						<Reference>
							<ParentLayer>wAxes_l</ParentLayer>
							<ParentField>GID</ParentField>
							<Cardinality>
								<Min>0</Min>
								<Max>1</Max>
							</Cardinality>
						</Reference>
					</References>
				</Field>
				<Field>
					<Name>END_AXIS_GID</Name>
					<Type>Text</Type>
					<References>
						<Reference>
							<ParentLayer>wAxes_l</ParentLayer>
							<ParentField>GID</ParentField>
							<Cardinality>
								<Min>0</Min>
								<Max>1</Max>
							</Cardinality>
						</Reference>
					</References>
				</Field>
			</Fields>
		</Layer>
		<Layer>
			<Name>wAxesAux_l</Name>
			<Geometry>Line Features</Geometry>
			<ZValues>true</ZValues>
			<CheckSelfIntersect>true</CheckSelfIntersect>
			<Fields>
				<Field>
					<Name>DESCRIPTION</Name>
					<Type>Text</Type>
					<Length>255</Length>
				</Field>
			</Fields>
		</Layer>
		<Layer>
			<Name>wConst_a</Name>
			<Geometry>Polygon Features</Geometry>
			<ZValues MinZ="0" MaxZ="0">true</ZValues>
			<CheckSelfIntersect>true</CheckSelfIntersect>
			<Fields>
				<Field>
					<Name>GID</Name>
					<Type>Text</Type>
					<Unique>true</Unique>
					<CheckRegExp>^.+$</CheckRegExp>
				</Field>
				<Field>
					<Name>CLS_TYPE</Name>
					<Type>Text</Type>
					<Length>50</Length>
					<CheckRegExp>^0901000|0902000|0903000|0904000|0905000|0906000|0908000|0910000|0911000|0514000$</CheckRegExp>
				</Field>
				<Field>
					<Name>ASUP_ID</Name>
					<Type>Long Integer</Type>
				</Field>
				<Field>
					<Name>ASUP_TYPE</Name>
					<Type>Short Integer</Type>
				</Field>
				<Field>
					<Name>ASUP_NAME</Name>
					<Type>Text</Type>
					<Length>50</Length>
				</Field>
				<Field>
					<Name>NAME</Name>
					<Type>Text</Type>
					<Length>255</Length>
				</Field>
			</Fields>
		</Layer>
		<Layer>
			<Name>wBridgeSpan_a</Name>
			<Geometry>Polygon Features</Geometry>
			<ZValues>true</ZValues>
			<CheckSelfIntersect>true</CheckSelfIntersect>
			<Fields>
				<Field>
					<Name>GID</Name>
					<Type>Text</Type>
					<Unique>true</Unique>
					<CheckRegExp>^.+$</CheckRegExp>
				</Field>
				<Field>
					<Name>CLS_TYPE</Name>
					<Type>Text</Type>
					<Length>50</Length>
					<CheckRegExp>^0901000$</CheckRegExp>
				</Field>
				<Field>
					<Name>TYPE</Name>
					<Type>Short Integer</Type>
					<CheckRegExp>^[1-5]$</CheckRegExp>
				</Field>
				<Field>
					<Name>DRIVING</Name>
					<Type>Short Integer</Type>
					<CheckRegExp>^[12]?$</CheckRegExp>
				</Field>
				<Field>
					<Name>JOIN_GID</Name>
					<Type>Text</Type>
					<References>
						<Reference>
							<ParentLayer>wConst_a</ParentLayer>
							<ParentField>GID</ParentField>
							<Cardinality>
								<Min>0</Min>
							</Cardinality>
						</Reference>
					</References>
				</Field>
			</Fields>
		</Layer>
		<Layer>
			<Name>wCarW_l</Name>
			<Geometry>Line Features</Geometry>
			<ZValues MinZ="1" MaxZ="2000">true</ZValues>
			<CheckSelfIntersect>false</CheckSelfIntersect>			
			<Fields>
				<Field>
					<Name>GID</Name>
					<Type>Text</Type>
					<Unique>true</Unique>
					<CheckRegExp>^.+$</CheckRegExp>
				</Field>
				<Field>
					<Name>CLS_TYPE</Name>
					<Type>Text</Type>
					<Length>50</Length>
					<CheckRegExp>^1002000|1006000|1007000|1009000|1010000$</CheckRegExp>
				</Field>
			</Fields>
		</Layer>
		<Layer>
			<Name>wRelief_l</Name>
			<Geometry>Line Features</Geometry>
			<ZValues MinZ="1" MaxZ="2000">true</ZValues>
			<CheckSelfIntersect>true</CheckSelfIntersect>
			<Fields>
				<Field>
					<Name>GID</Name>
					<Type>Text</Type>
					<Unique>true</Unique>
					<CheckRegExp>^.+$</CheckRegExp>
				</Field>
				<Field>
					<Name>CLS_TYPE</Name>
					<Type>Text</Type>
					<Length>50</Length>
					<CheckRegExp>^0504000|0505000|0506000|0509000|0510000$</CheckRegExp>
				</Field>	
			</Fields>
		</Layer>
		<Layer>
			<Name>wConW_l</Name>
			<Geometry>Line Features</Geometry>
			<ZValues MinZ="1" MaxZ="2000" MaxRake="1000">true</ZValues>
			<CheckSelfIntersect>true</CheckSelfIntersect>
			<CurvatureMinAngle>160</CurvatureMinAngle>
			<Fields>
				<Field>
					<Name>GID</Name>
					<Type>Text</Type>